Organization,Description,TargetIndustry,Governance,BusinessSupportType,Website,StreetAddress,Unit,City,Province,PostalCode,Title,ContactLastName,ContactFirstName,Telephone,Email
Toronto Fashion Incubator (TFI),"The Toronto Fashion Incubator (TFI) is an award-winning and highly-acclaimed non-profit organization dedicated to supporting and nurturing Canadian fashion designers and entrepreneurs. Housed in an 8,000 sq. ft. heritage building at Exhibition Place in Toronto, TFI provides strategic business-building programs and services including one-on-one mentoring, educational seminars and master classes, shared workspace, in-house design studios, exclusive networking, promotional and marketing opportunities, valuable trend and business resources and market leads.  TFI is the world's first official fashion incubator, established in 1987 by the City of Toronto. Since its launch, the TFI model has been adopted by over thirty global cities including London, Paris, New York, Milan, Amsterdam, Melbourne and Chicago. For almost three decades, TFI has fostered many of Canada’s most celebrated talents such as Sunny Fong of Project Runway Canada fame, Joeffer Caoc, David Dixon, Pina Ferlisi at McQ, Todd Lynn, Arthur Mendonça, Line Knitwear and Smythe.",Fashion,Not-for-profit,Incubator,http://www.fashionincubator.com,285 Manitoba Drive Exhibition Place  ,,Toronto,Ontario, M6K 3C3,Office Manager,Nina ,Facciolo,416-971-7117 ,nina@fashionincubator.com 
Toronto Food Business Incubator (TFBI),"Business Incubation involves dynamic business strategies to help build up strong, viable, companies from an idea and determination. Since starting up a small business can be such a challenge for most, a business incubator is often necessary to help nurture young companies those first few months or years until they have established themselves firmly in the community.; ; The new entrepreneur can look to the incubator for hands-on management assistance, education, information, technical and vital business support services, networking resources, financial advice as well as advice on where to go to seek financial assistance.; ; The goal of an incubator is not only to ensure the small business survives the start-up period where they are most vulnerable, but to produce confident, successful graduates that are well grounded financially and secure in their knowledge of how to run a productive business independently, within two or three years of start-up.; ; On the average ninety-five percent of an incubator's clients graduate, and eighty-seven percent of incubator graduates remain in business, according to the 'Impact of Incubator Investments Study', published in 1997, (NBIA). The resulting community benefits of an incubator are healthy companies, accelerated job growth and a significant return on investment for each development dollar spent.; ; The entrepreneurs emerging from the incubators often prove to be on the leading edge of developing new and innovative technologies, that are affecting society increasingly as they grow, with their quality of products and services. The incubator encourages clients to select a variety of small business to be viable and meet the varied needs of the community, including technology, service, manufacturing, empowerment, specialized and mixed uses, etc.",Food and Beverage,Not-for-profit,Incubator,http://www.tfbi.ca,1 Yonge Street,Suite 960,Toronto,Ontario,M5E 1E5 ,,Michael,Donahue   ,,mdonahue@tbdc.com   
University of Toronto - Impact Centre,"The Impact Centre at the University of Toronto is a cross-disciplinary institute dedicated to creating tangible value to society by drawing from university research excellence in the natural sciences. It aims to become the preeminent national model for proactive knowledge creation, technology translation, entrepreneurship, and industry- relevant student training.  The Impact Centre operates at the nexus of chemistry, physics, biology, engineering, materials science, nanotechnology and photonics, and strives to harness the collective expertise and untapped potential of the university community. This is done through partnerships and collaborative research projects with industry, training of students in the practice of entrepreneurship, and the accelerated productization of university inventions and technology.  The Impact Centre cultivates networks in areas of strength within the University of Toronto to spur the growth of new businesses and the creation of high-quality jobs in Ontario.  There is a focus on connecting students, researchers, and industry to collaborate on projects that address technical and globally relevant challenges and fostering clusters in areas as diverse as solid-state lighting, synthetic biology, nanomaterials, and high-tech devices.",Mixed,Academia,Accelerator,http://www.impactcentre.utoronto.ca,112 College Street,,Toronto,Ontario,M5G 1L6,Director,Cynthia,Goh ,,cgoh@chem.utoronto.ca
University of Toronto - Techno,"Created in 2010, Techno is an elite program for scientists and engineers –  “technopreneurs” –  who want to create technology-based companies. Starting only with scientific expertise, the technopreneurs are guided by experts to learn by doing, building their companies in the process.  Techno is about actual company creation. It has led to more than 60 new start-up companies in the “physical sciences” sector, aimed at giving us a better quality of life.  The Impact Centre at the University of Toronto presents the 5th annual Techno program for aspiring technopreneurs, targeted towards fresh science and engineering graduates, current students and faculty supervisors. The workshop will teach young entrepreneurs to successfully translate their scientific discoveries to commercializable products and services.  The workshop will provide sessions on:  • IP strategies • Product development • Funding your venture • Networking • Corporate governance • Market potential evaluation • Presentation skills • Topical tutorials on related subjects and inspirational guest talks.  The bulk of the time will be devoted to develop the actual business, with access to technical and business mentors and lab space. The IOS will provide lab space for engineering prototype development.  The intake will be in teams (suggested size 3-4) with complementary skill sets. Students with masters or doctoral degrees in sciences or engineering will be preferred; those with other background such as finance and management can join the tech teams. Students/faculty may bring their own technology ideas and work on them. Alternatively, for those with strong entrepreneurial bent of mind without a clearly identified project, we can help connect with a team or provide possible projects.  At the end of the intensive workshop the teams are expected to be ready with a go forward strategy for tech-based business. The Impact Centre will extend its Business a la Carte services to the teams who move forward.","Information, Communications and Technology",Academia,Accelerator,http://www.impactcentre.utoronto.ca/techno,112 College Street,Rm 411 ,Toronto,Ontario,M5G 1L6,,,,416 978 3875,info@imc.utoronto.ca
University of Toronto - The Creative Destruction Lab at The Rotman School of Management,"How it Works; ; Milestones are a central feature of Creative Destruction Lab at Rotman. Our observation is that the greatest weakness of smart, passionate, and dedicated (but inexperienced) entrepreneurs concerns the allocation of their scarce resources (time, capital, relationships). We focus the time, attention, and judgment of a number of successful entrepreneurs, the Lab's Group of Seven Fellows (G7), on working with founders to set specific milestones to guide the allocation of their resources. Milestones are of two types: business and technical. The careful selection of milestones is conducted to most efficiently reduce risk associated with the venture and maximize equity value as quickly as possible.; Specifically, every eight weeks (approximately) ventures meet with the G7. At each meeting, the G7 work with founders to set their milestones for the next meeting. A week before each meeting, ventures send the G7 a one-page summary of the milestones set for their venture in the previous meeting, describing their progress on each. During the meeting, the G7 provide founders feedback, introductions to key relationships to advance their venture, and new milestones for the next meeting. At each meeting the G7 identify the lowest performing venture, which is dropped from the program, allowing the Lab to focus additional resources on ventures with the highest chance of success.; The Lab provides workshops that are designed to increase the probability of venture success. Workshops are led by faculty and industry practitioners. Some are required while others are optional.; ; The Lab also gives ventures access to MBA students who are also interested in the start-up space and work with ventures to increase the likelihood of success .; ; The Lab also provides access to a place to work along with professional services (e.g., legal and accounting) at no cost.; ; In addition, the Lab hosts special events designed to provide ventures with access to early-stage investors (angel and venture capital), successful entrepreneurs, as well as potential partners, customers, recruits, and other key players in the technology entrepreneurship ecosystem.",Mixed,Academia,Accelerator,http://www.creativedestructionlab.com,105 St.George Street,,Toronto,Ontario, M5S 3E6,Associate Director ,Tom , Lowden,416 946 8374,Tom@creativedestructionlab.com
University of Toronto - The Hatchery,"The Hatchery serves University of Toronto students looking to start an entrepreneurial venture. We provide an ecosystem of resources and relationships to turn your brilliant idea into a viable business.  How does it work?  After you apply and are accepted into the Hatchery, you and your team will be given access to all the tools, fellowships, resources and the support network of the Hatchery. Your team will be matched with a suitable mentor, and as a team, you will go through the 3 main aspects of the process.  1)The Business Document - You will develop a document that gives an overview of your business model, using the support and resources of fellow members, faculty and coaches.  2)The Minimum Viable Product - Here you will develop a proof of concept of your business, or a prototype of your product. You will have access to University resources such as laboratories, equipment, computers, and testing facilities.  3)The Pitch - The Hatchery faculty and coaches will help you prepare your business presentation. The Hatchery will connect you with strategic partners with the goal of raising capital.  Participation in the Hatchery is open to teams comprised of University of Toronto students in which at least one of the students is registered in the Faculty of Applied Science and Engineering. Each team must contain at least two students, but typically should not have more than four. An application is required to be considered for membership.",Mixed,Academia,Accelerator,http://www.uoft.me/thehatchery,35 St. George Street ,Faculty of Applied Science & Engineering ,Toronto,Ontario, M5S 1A4,Director Engineering Entrepreneurship Hatchery at University of Toronto - Faculty of Engineering,Joseph,Orozco,,hatchery@ecf.utoronto.ca
University of Toronto - The Hub Ideation  and  Experimental Learning Centre,"As a student in residence at The Hub you will engage in team-based activities that will deepen your understanding of innovation and the process by which ideas are designed to take shape.  You will grow through your interaction with aspiring innovators across the UTSC campus, the University of Toronto overall, and the Toronto region.  We will guide you in finding and refining your idea. We will show you various new ways to create modern technological solutions and viable social initiatives via digital communication and information technologies.  You will gain valuable skills, knowledge, and sharpen your ingenuity so that your creativity can flourish.  In a nutshell, The Hub works lean, and teaches you the same principles in how to approach flexible, fast-paced innovation, particularly geared towards today’s tech solutions.","Information, Communications and Technology",Academia,Incubator,http://www.utsc.utoronto.ca/thehub,1265 Militray Trail ,Scarborough Campus,Toronto,Ontario, M1C 1A4,,Gray,Graffam,,ggraffam@utsc.utoronto.ca
University of Toronto - UTEST,"The UTEST Program is part of U of T’s growing ecosystem of incubators and commercialization support services. In partnership with MaRS Innovation, it provides nascent software companies with start-up funding, mentoring, business strategy and office space in the MaRS Discovery District facility.","Information, Communications and Technology",Academia,Accelerator,http://www.research.utoronto.ca/industry-and-partners/entrepreneurs-and-start-ups/utest/,101 College Street,Suite 402,Toronto,Ontario, M5G 1L7,,Derek,Newton,,derek.newton@utoronto.ca
Women in Film  and  Television (WiFT) ,"About the Program:; ; “The most beneficial thing about the Incubator is that it provides you with a 360-degree look at your project, including story, marketing, cast and budget. Between the instructors and other participants, you get amazing insight as to how your script is working and how to position your film in the marketplace.” –  Geordie Sabbagh, Producer.; ; The WIFT-T Development Incubator is a national initiative, designed to kickstart market-driven feature films and support the next generation of Canadian feature film professionals. Up to six emerging or mid-career producer/writer teams with feature length projects in development, receive the opportunity to work with Canadian and international producers, development executives and story editors.; ; This intensive 4-day incubator examines multiple aspects of feature film development—from writing, to financing, to marketing and distribution—through a series of small group sessions and one-on-one consultations with creative and business experts. Teams receive coaching and feedback instrumental to advancing their market-driven feature film projects to the next level.; ; Finally, the teams are matched with national story editors appropriate to their projects for services resulting in a revised draft within three months of the DI. Participants complete the program once they have submitted a revised script and final business reports.",Creative,Not-for-profit,Incubator,http://www.wift.com,110 Eglinton Avenue East ,Suite 601 ,Toronto,Ontario,M4P 2Y1,Programming & Business Affairs Manager,Renee,Robinson ,,rrobinson@wift.com
York Entrepreneurship Development Institute Accelerator,"With a chance to pitch and receive up to $500,000 in funding at the end of the program, YEDI hopes to broaden the horizon of innovation in Toronto and York Region. YEDI is a free start-up incubator based out of the Schulich Executive Education Centre at York University.  YEDI differs from other incubators in that it provides both an academic and practical education for innovators to transform their ideas into successful business models and efficient not-for-profit organizations. Ventures are accepted from any industry and ensure to provide mentorship and resources accordingly for both business and professional development.  In collaboration with the Schulich Executive Education Centre, JRCC, 3V Communications and more, YEDI accepts 15 participants per cohort and offers 3 program tracks (Incubator, Existing Not-For-Profit and International Start-Up).",Mixed,Academia,Incubator,http://www.yedinstitute.org,4700 Keele St.,,Toronto,Ontario,M3J 1P3 ,Program Director,Maria,Konikov,647-919-9334,mkonikov@yedinstitute.org
Youth Social Innovation Capital Fund,"Youth Social Innovation Capital Fund (YSI) believes in the potential of young entrepreneurs and their ability to have a significant impact in shaping their communities. YSI is committed to providing clients with the skills, connections, and financial resources to succeed, including:  - Financing solutions that focus on your character rather than collateral - Consistent and comprehensive support for the development of your enterprise and for your growth as a young social entrepreneur - Learning and mentorship opportunities to build your business skills and industry knowledge",Social Innovation,Not-for-profit,Incubator,http://www.youthsocialinnovation.org/,585 Dundas St. East,,Toronto,Ontario,,Managing Director,Jory,Cohen,416-828-4644,jory@youthsocialinnovation.org
