Organization,Description,TargetIndustry,Governance,BusinessSupportType,Website,StreetAddress,Unit,City,Province,PostalCode,Title,ContactLastName,ContactFirstName,Telephone,Email
Kinetic Café,"We help forward-thinking enterprises & disruptive startups challenge convention, imagine new possibilities & successfully bring meaningful products, services & experiences to the market that meet the needs of today's connected consumer. We do this by coupling world-class strategy & design capabilities with the deep technology & production expertise needed, in-house to bring ideas to life.","Information, Communications and Technology",Private,Incubator,http://www.kineticcafe.com,1 Yonge St,Suite 934,Toronto,Ontario,M5E 1E5,Co-Founder,Chris ,Carter ,,info@kineticcafe.com
Launch 180 Accelerator,"We want to work with early stage companies – right from the idea stage. We are not the right partner for all start-ups, but we think we’re a great partner for a select sub-segment of the GTA start-up market.  Our ability to add value cuts across a number of industry vertical categories. We look for start-ups and ideas that represent a unique solution to a highly defined business problem with significant value implications across a number of vertical categories (Retail, Sales and Marketing, Supply Chain, Travel/Hospitality, Entertainment).  We assess opportunities on the basis of the Founder/Team and their proposed business problem/solution set and the match to the skills, experience, and network of our advisors. More precisely we look for strong business generalists with a strong business problem / market focus and skills across marketing, systems, strategy, finance and not just technology.  Founders generally have 3 sources of capital:  - They can invest or raise capital (in order of founder sweat equity and capital, friends/family, angels) - They can generate revenue, and/or - They can spend less money  Our focus is on the latter two. To help start-ups achieve first revenue within 180 days, but perhaps even more importantly to  spend substantially less money in their initial start-up phase.  By addressing first revenue and expenditure issues in a very focused fashion we hope to fundamentally change the fund raising paradigm for our start-ups.  We are not organized around a cohort schedule rather are open to submissions on an ongoing basis. You can send us your business plan or deck or just book to meet us for a coffee.  So please contact us.",Mixed,Not-for-profit,Accelerator,http://www.launch180.com,51 Wolseley Street  ,,Toronto,Ontario,M5T 1S1,,,,+1 888 840-6668,
Mantella Venture Partners ,"Mantella Venture Partners is a venture capital partnership formed to invest in exceptional entrepreneurs, building market-altering mobile and Internet software businesses. MVP invests up to $500,000 at inception, with the ability to support subsequent rounds as required. We invest alone, or alongside other value-added venture and angel investors that share the belief that founder/investor alignment is key to building successful companies and profitable exits. Our portfolio companies benefit from active, hands-on involvement in all phases of growth, including business development, marketing, financing, and team development.;","Information, Communications and Technology",Private,Accelerator,http://www.mantellavp.com,488 Wellington St West,,Toronto,Ontario, M5V 1E3,,,,416-479-0779,info@mantellavp.com
MaRS Discovery District,"Located in the heart of downtown Toronto, MaRS Discovery District is one of the world's largest urban innovation hubs. MaRS helps entrepreneurs in the ICT, cleantech and health sectors launch, grow and scale the innovative companies that are building our future — startup ventures with broad economic and societal impact.; ;  Education Starting a business? Start at MaRS. We offer a full range of free entrepreneurship education programs and online resources — structured, practical learning tools that entrepreneurs around the globe have accessed and applied while starting and building their ventures.; ;  Expert advice and mentorship; ;  MaRS works with high-impact, growth-oriented startups. We offer our clients a range of services that help them take their business to the next level, all at no cost to them. Our advisors are seasoned entrepreneurs and business leaders with global reach, providing tailored, expert advice and industry insights on a range of topics, including:  business and product development, financing and capital structure, corporate strategy, marketing and go-to-market strategy, and pitching.; ;  Connections; ;  Our team of industry insiders provides referrals, introductions and key pitch opportunities for qualified ventures. Through our network, we also offer access to the funders, customers, partners and talent required to help ventures grow and scale.; ;  Funding; ;  Early-stage capital can be critical to a venture’s success. MaRS offers a range of products and services to help entrepreneurs find the funding they need to grow their business.",Mixed Bio-Medical,Not-for-profit,Accelerator,http://www.marsdd.com,101 College Street,Suite 100 - South Tower,Toronto,Ontario,M5G 1L7,"Director, Strategic Partnerships",Earl,Miller,,emiller@marsdd.com
Mobile Experience Innovation Centre (MEIC),"The Mobile Experience Innovation Centre is a not-for-profit association that supports design leadership, experience innovation and applied research in Canada's mobile and wireless industries.; ; Since its founding in 2007 by OCAD University, The Mobile Experience Innovation Centre (MEIC) has grown from a mobile sector strategy and lobbying initiative to Canada’s only organization focusing on design leadership, sector growth and integration, and innovation in mobile content, services and computing. MEIC offers a membership program to serve clients and partners alike. Its Board of Directors includes international businesses such as Microsoft and IBM, Canadian strategic companies such as RBC Royal Bank and GestureTek, public sector entities, SMEs, associations, universities, and colleges. Its wider membership includes all major mobile associations and a wide array of mobile industry partners.; ; MEIC focuses on supporting start-ups and early-stage entrepreneurs, research commercialization, and national and international advocacy on behalf of Canadian companies, creating a strong framework in a fragmented industry.; ; MEIC offers programs that work with SMEs, researchers and NGOs in Canada and abroad for the purposes of partnership, collaboration, research and business development.  All programs are designed to encourage research commercialization and business growth to Canadian SMEs, corporations and academic institutions. MEIC also hosts conferences, workshops and partners with other organizations to deliver quality and relevant events.For more information about our work, please see About.; ; Past research success include the first iteration of the Applied Research and Prototyping Program which resulted in 22 projects with Ontario-based SMEs and academic institutions over 18 months, the development and delivery of Innovation and Insight: Mapping Ontario’s Mobile Industry.","Information, Communications and Technology",Not-for-profit,Incubator,http://www.meic.ca,205 Richmond St West ,"2nd Floor, Room 7211 ",Toronto,Ontario, M5V 1V3,Director,Patricia,McCuthcheon,,patricia@meic.ca  
MultiplicityTO,"Accelerates the growth of early-stage technology businesses focused on software, internet and digital media.; ","Information, Communications and Technology",Not-for-profit,Accelerator,http://www.multiplicityaccelerator.com/,105 Victoria Street ,Suite 909,Toronto,Ontario,M5C 3B4,Co-founder ,Rajah,Lehal,,rlehal@multiplicityaccelerator.com
oneeleven,"We are a community of data-driven entrepreneurs.; ; By convening a network of venture capital, industry, academia and government, we are bridging the gap between research and commercialization; supporting the development of solutions to highly complex data problems; ","Information, Communications and Technology",Not-for-profit,Incubator,http://www.oneeleven.com,111 Richmond Street West    ,,Toronto,Ontario,M5H 3K6, Managing Director,Bilal,Khan,,Bilal@oneeleven.com
Ontario Centre of Excellence (OCE),"Ontario Centres of Excellence (OCE) drives the development of Ontario’s economy by helping create new jobs, products, services, technologies and businesses. Our comprehensive program suite covers almost all stages of business development and career advancement. In partnership with industry, OCE co-invests to commercialize innovation originating in the province’s publicly funded colleges, universities and research hospitals. We also support and invest in early-stage projects, where the probability of commercial success and potential total return on innovation are substantial. Another expanding focus for OCE is the development of the next generation of innovators through our entrepreneurship fellowships and programs for students and youth across Ontario. Our efforts are focused on sectors of the economy with the greatest potential to drive Ontario’s future prosperity and global competitiveness: energy and environment (including water); advanced manufacturing; advanced health technologies; and information, communications technologies and digital media. A trusted partner of government in program delivery, we are committed to advancing a whole-of-government approach as a means of streamlining funding application processes for companies and entrepreneurs - See more at: http://oce-ontario.org/about-us#sthash.pdvym5IC.dpuf; ","Information, Communications and Technology",Public,Incubator,http://www.oce-ontario.org,156 Front Street West ,Suite 200   ,Toronto,Ontario,M5J 2L6,Business Development Manager,Martin,Lord,,"martin.lord@oce-ontario.org   """""
Rogers Ventures,"Rogers Venture Partners (“RVP”) was established in 2012 as a newly minted $150M venture capital fund headquartered in Palo Alto. The RVP team brings a wealth of global operating and investing experience. At RVP, every one of the partners has an operating background and, most importantly, all came from the high tech industry. As a result, our partners are deeply rooted in the operating ecosystem, allowing portfolio companies to better develop key partnerships and establish meaningful customer contracts. We look to take active roles within each portfolio company and are committed to working towards a common vision of revolutionizing the status quo.; ",Mixed,Private,Accelerator,http://www.rogersvp.com/,350 Bloor Street East,,Toronto,Ontario,M4W 0A1,Vice President,Mike ,Lee,,contact@rogersventures.com
Round 13 Capital,"Round 13 is all about building great companies. We seek breakout potential, lead by passionate entrepreneurs committed to creating the next big thing.  But how to do it?  Money is key but equally critical is the right strategy after the initial success of developing a great product. Too many achieve this milestone but can’t meet the next challenge of building a world-class operating company.  Our team of done-it-before entrepreneurs and best-of breed domain experts can make the difference between success and failure, or even more exciting between an OK success and blockbuster status.  We are Canada’s first and only investor to draw upon the skills and networks of the most successful entrepreneurs. We were fussy in our choice of players. Relationships are core as is a winning culture. Without shared values, the odds of greatness are cut way down.  Our founders are proven builders with the passion and skills to fast track our companies. Finding the right people and right networks are all part of what we offer – if global success and massive shareholder wealth are part of your dreams.  Yes, we will selectively look at early stage companies but our real value is with companies that have proven market demand and now need ramp-up capital.  Passionate entrepreneurs with more than just a great idea together with the money and experience we bring is what it is all about.","Information, Communications and Technology",Private,Accelerator,http://www.round13capital.com,51 Mill Street,Suite 301,Toronto,Ontario,M5A 3C4,Entrepreneur,Bruce ,Croxon,,contact@round13capital.com
Ryerson University - Centre for Urban Energy,"The Innovation Centre for Urban Energy (iCUE) is a business incubator and accelerator focused on urban energy. The purpose is to assist young businesses turn their urban energy ideas into commercially viable products, services, and/or technologies. The iCUE was officially launched in November of 2012, and is housed within Ryerson University’s Centre for Urban Energy (CUE).  Among the primary goals of the iCUE are research innovation (applied research in collaboration with industry); business innovation (entrepreneurship); and student innovation (experiential learning). It supports the innovation process between ideation and technology development.",Environment,Academia,Incubator,http://www.cue.ryerson.ca,147 Dalhousie Street,,Toronto,Ontario, M5B 2M7,Director,Bala,Venkatesh ,,bala@ryerson.ca
Ryerson University - Design Fabrication Zone,"Ryerson Design Fabrication Zone (DFZ) is an interdisciplinary hub for design/fabrication innovation and entrepreneurship at Ryerson University. A joint venture between the Department of Architectural Science and the School of Interior Design, DFZ facilitates incubation and acceleration of ideas and strategically propels design learning and 3D production towards construction and/or business innovation.  The zone fosters rich networking opportunities for student-driven initiatives through mentorship, workshops, strategic partnerships and cross-disciplinary collaboration. The DFZ offers access to traditional and digital fabrication technologies (rapid prototyping, CNC and CAD/CAM) enabling members to prototype and model ideas in order to test, evaluate and realize design concepts.","Information, Communications and Technology",Academia,Incubator,http://dfz.ryerson.ca/,350 Victoria St,,Toronto,Ontario,M5B 2K3,,Johanna,Vandermaas,,johanna.vandermaas@ryerson.ca
Ryerson University - Digital Media Zone,"The Digital Media Zone (DMZ) at Ryerson University is one of Canada’s largest business incubators and Coworking spaces for entrepreneurs. The top-ranked university incubator in Canada and fifth in the world, it helps startups succeed by connecting them with customers, advisors, influencers and other entrepreneurs.  The DMZ is based at Ryerson but it’s not just for students; this unique community is home to entrepreneurs and innovators of all ages from across Toronto, Canada and the world. Overlooking the heart of downtown Toronto at Yonge-Dundas Square, the DMZ is a hub of innovation, collaboration and experiential learning.  The DMZ opened its doors in April 2010. Ryerson University president Sheldon Levy saw the value in creating a space on campus that would encourage students, alumni and young entrepreneurs from the wider community to collaborate, innovate and create. The goal was to forge a home for digital industry and entrepreneurship in Toronto, and keep talent in Canada. Since then, the DMZ has incubated more than 130 startups that have raised over $40 million in funding and fostered the creation of more than 1,200 jobs.  The success of the DMZ has inspired a thriving multidisciplinary ecosystem for innovation and entrepreneurship at Ryerson University.  A network of other zones has been created, each specializing in sectors that are poised for growth and transformation. These zones are helping to support the next wave of entrepreneurs from Ryerson and beyond.  Entrepreneurship isn’t a trend; it’s key to the future of economic prosperity in Canada. The DMZ is helping strengthen that future by fuelling the success of emerging entrepreneurial leaders.","Information, Communications and Technology",Academia,Incubator,http://www.digitalmediazone.ryerson.ca ,10 Dundas Street East Ontario ,Suite 600,Toronto,Ontario,M5B 2G9,Director    ,Valerie,Fox,416-979-5000,vfox@ryerson.ca
Ryerson University - Fashion Zone,"We are Canada’s newest incubator for fashion-inspired startups! Working with Ryerson University’s students, alumni, faculty and our growing network of industry professionals, we are focused on launching Canadian fashion businesses. With almost half the available jobs in the Canadian fashion industry being outsourced overseas, the Fashion Zone was created to introduce entrepreneurship as a new viable career path to fashion students, alumni and industry professionals. This is so that we may create, maintain and improve fashion-related job opportunities in Canada.  Through a supportive framework and multi-level participant model, we match Mentors, Associates and Apprentices to a Fashion zone company, allowing them to apply their existing skills and develop new ones, while accelerating a fashion business. We also accept Research projects that have a focus on fashion innovation. Our extensive resource bank ensures we are able to cater to all fashion-inspired businesses.  Ranging from physical equipment, to workspace, mentors and multiple types of advisors, we help our participants create and test their products, consult with professionals, commercialize innovative ideas and grow their fashion businesses.  Finally, the culture we are creating is focused on innovation, collaboration and creativity - a breeding ground for great ideas.  Examples of businesses we accept - Wearable Tech, E-commerce, Mobile Applications, Women’s Wear, Men’s Wear, Children’s Wear, Textile Innovations, Functional Apparel (sport, medical, etc), Accessories, Fashion Buying, Magazines, and Visual Arts.",Fashion,Academia,Incubator,http://www.fashionzone.ca/,10 Dundas St. E. ,B2 Floor,Toronto,Ontario,M5B 2G9,Managing Director,Olga,Okhrimenko,,olga@fashionzone.ca
Ryerson University - Startmeup Ryerson,"We provide a supportive and structured process to meet the needs of students and alumni from all disciplines. Whether you are in the idea stage or have already started your new venture, we look forward to meeting you, hearing about your passions, and helping you take your vision to the next level.  We’ve created an on-line community access portal at www.StartMeUpRyerson.com to provide full details, resources, and access to the program.  The StartMeUp process is managed by Students in Free Enterprise (SIFE) and strongly supported by faculty, university administration, sector experts, community activists, and other partners. As shown in the figure, there are many access points to the program at events and one-on-one orientations, as well as our on-line portal. No matter what your academic background, the StartMeUp Program can work for you! Experts provide supportive feedback and personal recommendations. All appropriate participants are given a customized development program as well as access to various funding sources.","Information, Communications and Technology",Academia,Incubator,http://www.ryerson.ca/rei/startmeup_process/,575 Bay Street,Ryerson University Ted Rogers School of Management TRS 3-139,Toronto,Ontario, M5G 2C5,Director,Valerie,Fox,,vfox@ryerson.ca   
Ryerson University - Transmedia Zone,"The Transmedia Zone develops student skills in ideation, collaboration, and prototyping for the digital content sector.  Transmedia Zone team members and individuals can engage in experiential learning projects that focus on the future of storytelling.The emphasis is on creative innovation and design thinking for media-makers, with best practices developed through iterative design, rapid prototyping and collaborative Coworking. Student-led projects in the Transmedia Zone can lead to further innovations in artistic, business, design and multi-disciplinary fields. Students may apply as individuals or as teams (depending on the proposal).  After being successfully admitted to the Transmedia Zone as per its established criteria, students have the option to be in the Optional Specialization through the following tracks:  - Students may choose to propose their own Zone-framed activity and seek guidance from fellows and faculty members at Ryerson; - Students can also work on a project developed in collaboration with a chosen mentor (an affiliated fellow or faculty-member), who will provide mentorship; - or Students may choose to work in ongoing or sponsored projects in the Zone by requesting and gaining the consent of the Zone management-team, project participants, or principal investigators.",Mixed,Academia,Incubator,http://www.rtatransmediacentre.com/,350 Victoria Street,,Toronto,Ontario,M5B 2K3,Director of Development,Kathleen ,Webb,416-878-8876,kathleen.webb@me.com
School for Social Entrepreneurs Ontario (SSE- O),"The School for Social Entrepreneurs Ontario helps people from all backgrounds to transform their passion and talents into sustainable solutions to poverty, social exclusion, environmental stress, and other societal challenges.; ; SSEO offers a non-traditional and unique training model for social entrepreneurs, people with great ideas for non-profits, cooperatives, for-profit ethical businesses, and other social ventures that will benefit their community. We prioritize students' individual growth within the context of their projects, and connect them to a network of mentors, experts, accomplished entrepreneurs, and social investors.; ; SSEO is a proud member of an international network of schools located also in the UK, Australia, and Ireland.; - See more at: http://www.the-sse.org/schools/11/ontario/60/about-sseo#sthash.mG86q44D.dpuf",Social Innovation,Not-for-profit,Incubator,http://www.sseontario.org,540 Dundas St East  ,,Toronto,Ontario, M5A 3B7,Interim Director     ,Miles,DePaul,,"mdepaul@sseontario.org  """""
SheEO,"The SheEO Program brings together 10 women-led ventures for a series of sessions based on the 8 SheEO Principles from Think Like A SheEO: Succeeding in the Age of Creators, Makers and Entrepreneurs.  The program provides business advisory services, financing and ongoing mentoring to female entrepreneurs.",Mixed,Not-for-profit,Incubator,http://www.iamasheeo.com/,10 Dundas Street East    ,#502,Toronto,Ontario,M5B 2G9,Co-Founder,Vicki,Saunders,,vicki@iamasheeo.com
Social Titan Labs Accelerator,"At Social Titan Labs, we provide companies with a full spectrum of technology solutions. We build mobile and enterprise grade applications for multiple platforms and devices. We also accelerate social, mobile and web products for entrepreneurs and investors.; ; Our Company Culture; ; Our team is made up of engineers, digital strategists, and designers from around the world. We Operate in multiple time zones so we can offer 24 hour support.; ; Our Services; ; Our primary focus is on technology and accelerating startups. We partner up with investors and entrepreneurs looking to build out products and companies in the social and mobile.; ; Our Work; ; We also provide Fortune 500 brands with technology solutions to take their business further. Check out a few of our latest projects for an inside look at the work we've done.; ",Mixed,Private,Accelerator,http://www.socialtitanlabs.com,20 Bay Street,,Toronto,Ontario,M5J 2N8,,,,1-888-483-3331,info@majesticmedia.ca
The Next 36 ,"The Next 36 addresses Canada's deficit of high impact entrepreneurship by providing resource-rich education programs to promising young entrepreneurs. It was founded by a small group of business leaders and academics and is championed by Founding Patrons W. Galen Weston, Paul Desmarais, Sr. and Jimmy Pattison.  We believe that by fast-tracking the development of Canadas most talented young innovators, we will help create industry-changing businesses and grow Canada's long-term prosperity.  The Next Founders is the second program from The Next 36 and is designed for young founders of tech start-ups looking to scale quickly.; ","Information, Communications and Technology",Academia,Incubator,http://www.thenext36.ca,130 Bloor Street West, Suite 702 ,Toronto,Ontario,M5S 1N5 ,"Jon French, Director of Marketing & Events",Jon,French,,jon@thenext36.ca
Toronto Business Development Centre (TBDC) ,"TBDC's Business Incubation Program supports the growth of new and emerging businesses by providing access to a range of key resources such as business advisory support and participation in community of successful entrepreneurs.; ; Business incubation catalyzes the process of starting and growing companies. A proven model, it provides entrepreneurs with the expertise, networks and tools they need to make their ventures successful. Business incubation programs diversify economies, commercialize technologies, create jobs and build wealth.; ; Business incubators nurture new and emerging ventures, helping them to survive and grow during the start–up period when they are most vulnerable. Incubators provide hands-on business advisory support, access to financing and orchestrated exposure to critical technical support services. A business incubation program’s main goal is to produce successful graduates – businesses that are financially viable and freestanding when they leave the incubator, usually within two to four years.; ; If you want your business to achieve it’s goals faster, TBDC's Business Incubation Program may be the catalyst you need.",Mixed,Not-for-profit,Incubator,http://www.tbdc.com,900 - 1 Yonge Street,,Toronto,Ontario,  M5E 1E5,,Michael, Donahue,416.345.8621,mdonahue@tbdc.com
